{
  "schemaVersion": 2,
  "manifestHash": "3d898dd9d89cc5cfdcb464c017bc139218d35387e8f72f1dcbc17f80a0a6a9f3",
  "sources": {
    "agent-plugins-spec": {
      "repository": "https://github.com/agentplugins/agent-plugins-spec.git"
    }
  },
  "artifacts": {
    "agent-plugins-schemas": {
      "source": "agent-plugins-spec",
      "commit": "ff8ab5e392cc87bd88d87c060815a87490e51003",
      "track": {
        "branch": "main"
      },
      "kind": "directory",
      "path": "schemas/1.0.0",
      "destination": "schemas/upstream/agent-plugins/1.0.0",
      "resources": [
        {
          "path": "LICENSE.md",
          "destination": "LICENSE.md"
        },
        {
          "path": "LICENSES/Apache-2.0.txt",
          "destination": "LICENSES/Apache-2.0.txt"
        }
      ],
      "files": {
        "mcp.schema.json": {
          "sha256": "6539175bfcdf43085855183e86da40ea94b166547a72b47ae9a0a390516d3acb",
          "mode": "100644"
        },
        "plugin.schema.json": {
          "sha256": "0a4aad95ce337878ad38802ebf0daa3fde76abe3f65400c86bcbb1ec0b3ab883",
          "mode": "100644"
        },
        "LICENSE.md": {
          "sha256": "c614e83c1e0d6b1a53feb0d279fbfcfc2cc048ba34c19b751315d7dbb481c7a5",
          "mode": "100644"
        },
        "LICENSES/Apache-2.0.txt": {
          "sha256": "cfc7749b96f63bd31c3c42b5c471bf756814053e847c10f3eb003417bc523d30",
          "mode": "100644"
        }
      },
      "digest": "57a4a9f25af9c6bf4c0fa000916786f4d89bee51229a4c5dd9d686e90d3f9b5f",
      "inspection": {
        "format": "directory",
        "validation": "not-requested",
        "skills": [],
        "mcpServers": [],
        "extensions": [],
        "diagnostics": []
      }
    }
  }
}
